{
  "$schema": "http://json-schema.org/draft-07/schema#",
  "$id": "https://github.com/sikulovi-s-r-o/claude-code-cz-sk-spinner-verbs/schemas/theme.schema.json",
  "title": "Spinery theme",
  "type": "object",
  "required": ["name", "description", "tags", "spinnerVerbs"],
  "additionalProperties": false,
  "properties": {
    "name": {
      "type": "string",
      "pattern": "^[a-z0-9-]+$",
      "minLength": 2,
      "maxLength": 40
    },
    "description": {
      "type": "string",
      "minLength": 10,
      "maxLength": 200
    },
    "tags": {
      "type": "array",
      "items": {
        "type": "string",
        "pattern": "^[a-z0-9-]+$",
        "minLength": 2,
        "maxLength": 30
      },
      "minItems": 1,
      "maxItems": 10,
      "uniqueItems": true
    },
    "spinnerVerbs": {
      "type": "object",
      "required": ["mode", "verbs"],
      "additionalProperties": false,
      "properties": {
        "mode": {
          "enum": ["replace", "append"]
        },
        "verbs": {
          "type": "array",
          "items": {
            "type": "string",
            "minLength": 1,
            "maxLength": 60
          },
          "minItems": 10,
          "maxItems": 100,
          "uniqueItems": true
        }
      }
    }
  }
}
