{
  "name": "wc3-lide",
  "description": "Verbatim Czech dub quotes from Warcraft 3 Human units",
  "tags": ["cs", "games", "retro", "dubbing", "warcraft", "wc3"],
  "spinnerVerbs": {
    "mode": "replace",
    "verbs": [
      "Hurá do práce!",
      "Mám špatný den",
      "Je to vaše poslední slovo?",
      "Pusť toho vesničana!",
      "Ano, Vládče",
      "Stačí slovo",
      "Uchop meč, jdi na zteč",
      "Strýc Lotár tě potřebuje",
      "Nabito a odjištěno",
      "Tohle je moje bouchačka",
      "Nemám pivo",
      "Tak pojď do bříška",
      "Zbraně lidi nezabíjí. Já jo",
      "Nemíř na mě tou věcí",
      "Oddělal jsem šarifa",
      "Skalpel? Houbu? Kouzelnou hůlku?",
      "Ve světle najdete klid a mír",
      "Vstupte do světla",
      "Klikni si na mě ještě jednou, brouku!",
      "Potřebuješ něco, hafíku?",
      "Možná by ti pomohla dobrá příručka",
      "Kouzlo konec světa",
      "Sešleš stiskem Ctrl, Alt a Delete",
      "Žízním po magii",
      "Ve vzduchu cítím magii",
      "Ukradl jsem tvého miláška",
      "Já jsem TNT, a já Dynamit",
      "My jsme trpaslíci",
      "Bombardovat!",
      "Teď budu demonstrovat Dopplerův efekt",
      "Chápete? Aeroplán?",
      "Důležité je, jak se s ní zachází",
      "Jdem se zhulákat!",
      "Jsou tady někde k dostání hranolky?",
      "Nic nemotivuje jako boj s kocovinou"
    ]
  }
}
