{
  "name": "warcraft-cz",
  "description": "Verbatim quotes from the Czech dub of Warcraft III: Reign of Chaos",
  "tags": ["cs", "games", "retro", "dubbing", "warcraft"],
  "spinnerVerbs": {
    "mode": "replace",
    "verbs": [
      "Zase práce?",
      "Hurá do práce!",
      "Mám práci, nechte mě",
      "Už je to tak, je ze mě mrtvola",
      "Vy že jste král? Já vás volit nebudu!",
      "Pomóc jsem utlačovanej!",
      "Stačí slovo",
      "Uchop meč, jdi na zteč",
      "Strýc Lotár tě potřebuje",
      "Nabito a odjištěno",
      "Tohle je moje bouchačka",
      "Nemám pivo",
      "Tak pojď do bříška",
      "Zbraně lidi nezabíjí. Já jo",
      "Nemíř na mě tou věcí",
      "Oddělal jsem šarifa",
      "Ve světle najdete klid a mír",
      "Klikni si na mě ještě jednou, brouku!",
      "Potřebuješ něco, hafíku?",
      "Zavřít oči brouku a píchat",
      "Kouzlo konec světa",
      "Sešleš stiskem Ctrl, Alt a Delete",
      "Žízním po magii",
      "Já jsem TNT, a já Dynamit",
      "My jsme trpaslíci",
      "Bombardovat!",
      "Za Hordu život položím!",
      "Být zelený není vůbec jednoduché",
      "Můj hlas nezní jako Yodův",
      "Dabu!",
      "Lok'tar Ogar!",
      "Svítí, svítí slunce nad hlavou",
      "Čestmíre, já letím",
      "Létající Čestmír!",
      "Padá nebe",
      "Smlouva je spečetěna",
      "Má trpělivost je u konce",
      "Já jsem temnota",
      "Copak už peklo zamrzlo?",
      "Nedotýkej se mě, jsem zlý",
      "Vidím nemrtvé lidi",
      "Miluji smrt, častokrát",
      "Mrazivý smutek hladoví!",
      "Sloužím jedině ledovému trůnu",
      "Strachuj se skutků strašných srn",
      "Jedině ty můžeš zabránit lesním požáru",
      "Medvědi nevědí, že turisti nemají zbraně",
      "Kdepak je můj malý chundeláček?",
      "Tož, co mám podělat?",
      "Důvěřuj ale prověřuj!"
    ]
  }
}
