{
  "name": "wc3-elfove",
  "description": "Verbatim Czech dub quotes from Warcraft 3 Night Elf units",
  "tags": ["cs", "games", "retro", "dubbing", "warcraft", "wc3"],
  "spinnerVerbs": {
    "mode": "replace",
    "verbs": [
      "Bohyně, osviť mou pouť",
      "Přísáhala jsem odplatu",
      "Říkala jsem tětivu luku, žádnou úsečku",
      "Tohle je můj vír",
      "Jsem tu, abych si urvala svůj díl",
      "Já nejsem ta dryáda, kterou sis hledal",
      "Strachuj se skutků strašných srn",
      "Ty komunikuješ tak, že na mě klepneš",
      "Já nejsem v říji, svědí mě hlava",
      "Už padni jako listí",
      "Všechno je to moje vina",
      "Ve jménu Nordrassila",
      "Jedině ty můžeš zabránit lesním požáru",
      "Raději bych odpočíval",
      "Medvědi nevědí, že turisti nemají zbraně",
      "Nemohu přestat tančit",
      "Přestaň klepat na můj hnědý zadek",
      "Větry už vanou a já přicházím",
      "Organizace tady stojí za starou pelu",
      "Klidně ti řeknu víc. Ale pak tě zabiju",
      "Jsem temný elf",
      "Nech toho, jsem alergický na peří",
      "Jsem tichý, ale smrtící",
      "Druid pařát",
      "Kdepak je můj malý chundeláček?",
      "Mám oči na stopkách",
      "Můj tygr byl vycvičen pro válku",
      "Moji tygři sloužili v Cirkusu Humberto",
      "Neohlížej se, jde za námi tygr",
      "Můj meč prahne po krvi",
      "Krev démona je hustší než obyčejná krev",
      "Volala mi temnota, ale měla vyvěšené sluchátko",
      "Jsem ocelovou pěstí zákona",
      "Spravedlnost možná slepá je, já však nikoliv"
    ]
  }
}
