{
  "name": "pelisky",
  "description": "Verbatim quotes from the 1999 Czech film Pelíšky",
  "tags": ["cs", "movies", "nostalgic", "humor"],
  "spinnerVerbs": {
    "mode": "replace",
    "verbs": [
      "Brašule! Maršál Malinovskij!",
      "Kde udělali soudruzi z NDR chybu?",
      "Dávám bolševikovi rok, maximálně dva",
      "Mě vyslýchali nacisti, nacisti, děvenko!",
      "Tady něco hrozně smrdí!",
      "Zůstaň doma, aspoň neuděláš žádnej průser",
      "Mě dlouho rozčilovat nebudeš, ty smrade!",
      "Knedlíky? Noky.",
      "Nikdy! Nebo navždy.",
      "To je pohoda, když není táta doma!",
      "Olovo volovo",
      "Naprosto vyloučený",
      "Typický nok je slizký",
      "Kluci! Ne abyste se zase sázeli!",
      "Skláři nebudou mít co žrát",
      "Máme zase rajskou?",
      "Mami, brácha je mrtvej!",
      "Líbali se, líbali!",
      "A teď náušnička, jako třešnička",
      "Soudružka učitelka",
      "Šťastný a veselý",
      "Chtělo se mi umřít",
      "Jinak je to tady na hovno",
      "Dejchá. Slyším, jak dejchá.",
      "A pod vodou se musí šlapat?"
    ]
  }
}
