{
  "name": "brnensky-trener-best",
  "description": "Best-of verbatim quotes from the viral Nasraný trenér dorostu z Brna rant (NSFW, Brno dialect)",
  "tags": ["cs", "meme", "internet", "sport", "nsfw", "morava"],
  "spinnerVerbs": {
    "mode": "replace",
    "verbs": [
      "Pánové, já Vám na to seru",
      "Nebudu se bavit s vašima matkama, ani s jednou",
      "Nezajímá mě to",
      "Nazájem, pravděpodobně seš tady dneska naposled",
      "Vůbec mě to nezajímá, to sou vaše problémy",
      "Tyhle ty pičoviny si řešte v Břeclavi",
      "Tak a teď ke konstruktivní práci",
      "Šplíchačka",
      "Řekneš fotrovi a získáte si takovou tu věrností kartu",
      "Budeš bydlet kde?...v tvarohárně",
      "Já ti dám o kostici, vole, až ti bude špatně vole",
      "Když budeš žrát rýži, nemůžeš žrát maso",
      "Brambory zapomeňte, vepřový maso se žrat nebude",
      "Já se nebudu tady divat na to vole, že nemáte energii",
      "Už tak ju nemáte a ještě blbě žerete",
      "Mám trošku strach, že kdybych foukl, že bys odletěl do Líšně",
      "Žádný z Kauflandu, Teska a tady tyhlety sračky",
      "Pokud vám bude těžko, tak si můžete dát zero kolu, ale výjimečně",
      "Brambory to vubec, to už neexistuje, to je škrtly",
      "O smaženým žrádle se ani nebudeme bavit",
      "Nechci vidět, že budete žrát nějaký čínský přejetý psi",
      "Kebaby, u těch cigánů špinavejch, smradlavejch tam",
      "Jestli uvidím pizzu, nakopnu ho do prdele, vyletí před zimák",
      "Nebudu se divat, že někdo zývá nebo si protírá voči",
      "To, že jste se dva měsíce flákali, to je vrchol",
      "Tady je to jak lazaret a to je vám 15 let",
      "Nejste zvyklí na sobě systematicky pracovat",
      "Toho jsem určil, protože samozřejmě tomu rozumim",
      "Že se chcete zlepšovat",
      "Že chcete být nejlepší",
      "Že si tady vytřeme prdel s tou Kometou posranou",
      "Ne to co tady předvádíme my",
      "Jenom kvůli tomu, že jste se flákali 2 měsíce",
      "Jste normální, nebo co?",
      "Co mě je potom, kurva?",
      "Vy jste tady zodpovědní za to, každej z vás",
      "Nenuťte ty rodiče, aby to platili",
      "Neserte mě, abych já tady vydával energii",
      "Nemám na to náladu ani čas",
      "Rychle si odletím zpátky na Floridu",
      "Nebudu se tady s nikým srat",
      "Každej se tady zatím zamyslete co vám tady vykládám",
      "Už to skončilo ta sranda",
      "Od teďka začínáme pracovat",
      "Já su zvyklej hrát jenom o titul",
      "Zapomeňte na to",
      "Ze všema se bude vyhrávat",
      "A kdo nás porazí, tak dostane na tlamu",
      "Tak to tady bude, vod teďka",
      "Vopůl budou všichni veku",
      "Jdeme okamžitě do posilovny",
      "A nechcu nic slyšet",
      "A zapomeňte, že mi budou rodiče volat, nebo něco psat",
      "Konec"
    ]
  }
}
