{
  "name": "wc3-neutralni",
  "description": "Verbatim Czech dub quotes from Warcraft 3 Neutral units",
  "tags": ["cs", "games", "retro", "dubbing", "warcraft", "wc3"],
  "spinnerVerbs": {
    "mode": "replace",
    "verbs": [
      "Já jsem ready",
      "Mně říkají stoupa",
      "Mám zlost, mám hlad",
      "Tak tudy. Ne, tudy",
      "Dali mi na starost hlupáka",
      "Jatka mohou začít",
      "Je libo sekeru?",
      "Pro tebe i zabiju",
      "Ledově svěží",
      "Schlaď si hlavu",
      "Potřebuješ jelení lůj",
      "Stojím tu jak solné slob",
      "Tož, co mám podělat?",
      "Já tu vidím jediné problém",
      "Problém v té komunikaci",
      "Tož, já radši dělám sám",
      "Každou noc nemusí být vražda",
      "Jsem snad nějaká slečinka?",
      "Za Sanfíra",
      "Nebuď tak nesmělý",
      "Nechceš mi koupit drink?",
      "Co kdybychom si o tom promluvili v salonku?",
      "Vysměju se smrti do tváře",
      "Odsud vypadají všichni jako mravenci",
      "Třpytivé knoflíčky",
      "Kde pak je rovník?",
      "Myslíš tvůj obličej s mým zadkem?",
      "Je libo páreček?",
      "Raději jsem se měl stát farmářem",
      "Mizerný plat, neustále v nebezpečí",
      "Neplýtvej mým časem",
      "Třeste se přede mnou",
      "Lidé pochází z Marsu, já z hrobu",
      "Můj luk je připraven",
      "Neznáším to, čím jsem se stala"
    ]
  }
}
