{
  "name": "brnensky-trener-full",
  "description": "Full verbatim transcript from the viral Nasraný trenér dorostu z Brna rant (NSFW, Brno dialect)",
  "tags": ["cs", "meme", "internet", "sport", "nsfw", "morava"],
  "spinnerVerbs": {
    "mode": "replace",
    "verbs": [
      "Pánové, já Vám na to seru",
      "Nebudu se bavit s vašima matkama, ani s jednou",
      "Žádná matka mě nebude volat ani komunikovat",
      "Nezajímá mě to",
      "Nazájem, pravděpodobně seš tady dneska naposled",
      "Vůbec mě to nezajímá, to sou vaše problémy",
      "Toto je extra liga dorostu, nejvyšší soutěž",
      "Tyhle ty pičoviny si řešte v Břeclavi",
      "Tak a teď ke konstruktivní práci",
      "Všichni budou vybaveni C vitamínem 1000",
      "Každej den ráno na hlačnej žaludek polkneš C 1000",
      "Máte puštěný nahrávání? Už máte nahrávat",
      "Teprve pak se bude snídat",
      "Když do něj vlítnu já, tak ho přerazím vejpůl",
      "Šplíchačka",
      "Řekneš fotrovi a získáte si takovou tu věrností kartu",
      "Budeš bydlet kde?...v tvarohárně",
      "Lošťák, další takovej",
      "Já ti dám o kostici, vole, až ti bude špatně vole",
      "Když budeš žrát rýži, nemůžeš žrát maso",
      "Brambory zapomeňte, vepřový maso se žrat nebude",
      "Včetně šunky, tu můžete jenom krůtí",
      "Budete žrát minimálně 5x denně",
      "Hlavní jídla jsou snídaně, oběd a večeře",
      "Nebo tam bude broskvová výživa",
      "50 minut před tréninkem, nejpozdějc",
      "Já se nebudu tady divat na to vole, že nemáte energii",
      "Už tak ju nemáte a ještě blbě žerete",
      "Další kdo půjde na farmu je Pospec",
      "To je další takovej",
      "Mám trošku strach, že kdybych foukl, že bys odletěl do Líšně",
      "2x v týdnu budete žrát hovězí maso",
      "2x až 3x v týdnu bude krůtí",
      "Žádný z Kauflandu, Teska a tady tyhlety sračky",
      "Maximálně může být sklizeno, nebo Dobrej špajz",
      "Kuřecí jenom z farmy",
      "Polívky vůbec",
      "Pítí může být perlivá voda",
      "Pokud vám bude těžko, tak si můžete dát zero kolu, ale výjimečně",
      "Vajíčka 2x v týdnu",
      "Samozřejmě největší tlusťoch v mančaftu",
      "Brambory to vubec, to už neexistuje, to je škrtly",
      "O smaženým žrádle se ani nebudeme bavit",
      "Nechci vidět, že budete žrát nějaký čínský přejetý psi",
      "Kebaby, u těch cigánů špinavejch, smradlavejch tam",
      "Nebo pizzu, no to ani náhodou hošánci",
      "Jestli uvidím pizzu, nakopnu ho do prdele, vyletí před zimák",
      "Připravíte si hokejky a na broušený brusle",
      "Nebudu se divat, že někdo zývá nebo si protírá voči",
      "Nebo něco takovýho, neexistuje",
      "To, že jste se dva měsíce flákali, to je vrchol",
      "Kromě třech týmů v extralize mám všude svoje hráče",
      "Neexistuje aby jeden chyběl, nebo si stěžoval na koleno",
      "Okostici voe, nebo já nevím co",
      "Tady je to jak lazaret a to je vám 15 let",
      "Vaše tělo vůbec neví co je okostice nebo achylovka",
      "Nejste zvyklí na sobě systematicky pracovat",
      "Toho jsem určil, protože samozřejmě tomu rozumim",
      "Ti co to mají za trest, to mají za trest",
      "Ten trenink může i pro vás, pro vás samotný",
      "Že se chcete zlepšovat",
      "Že chcete být nejlepší",
      "Že chcete vyhrát titul",
      "A tak dále",
      "Že si tady vytřeme prdel s tou Kometou posranou",
      "Ne to co tady předvádíme my",
      "Jenom kvůli tomu, že jste se flákali 2 měsíce",
      "Ještě tady budu řešit s paní Láníkovou",
      "Že neví, kdy má její syn trénink",
      "Jste normální, nebo co?",
      "Co mě je potom, kurva?",
      "Vy jste tady zodpovědní za to, každej z vás",
      "Nenuťte ty rodiče, aby to platili",
      "Neserte mě, abych já tady vydával energii",
      "Nemám na to náladu ani čas",
      "Rychle si odletím zpátky na Floridu",
      "Nebudu se tady s nikým srat",
      "Každej se tady zatím zamyslete co vám tady vykládám",
      "Už to skončilo ta sranda",
      "Od teďka začínáme pracovat",
      "Já su zvyklej hrát jenom o titul",
      "Se tady nebudu dívat, že sem přijede nějakej Tábor",
      "Nebo tam v té prdeli za tou Plzní kde jsme byli",
      "Zapomeňte na to",
      "Ze všema se bude vyhrávat",
      "A kdo nás porazí, tak dostane na tlamu",
      "Tak to tady bude, vod teďka",
      "Vopůl budou všichni veku",
      "Jdeme okamžitě do posilovny",
      "Pak se bude běhat, skákat, pak se bude bruslit",
      "A nechcu nic slyšet",
      "A zapomeňte, že mi budou rodiče volat, nebo něco psat",
      "Konec"
    ]
  }
}
