{
  "name": "cimrman",
  "description": "Verbatim phrases and play titles from the Jára Cimrman theatre universe",
  "tags": ["cs", "theatre", "humor", "retro"],
  "spinnerVerbs": {
    "mode": "replace",
    "verbs": [
      "Každé zbytečné slovo je zbytečné",
      "Lepší pivo v žaludku nežli voda na plicích",
      "Život je nejlepší školou života",
      "Nepochválím-li se sám, nikdo to za mne neudělá",
      "Budoucnost patří aluminiu!",
      "Do hospody s umytýma nohama!",
      "Chlast – slast",
      "Jdu na sever, a teď jdu na jih!",
      "Teplé pivo je horší než studená Němka",
      "Nemohou ani naznačovat",
      "Jsem přenošené dítě",
      "Existuje okolní svět a neexistuji já",
      "Externismus",
      "Liptákov",
      "Posel z Liptákova",
      "Dobytí severního pólu",
      "Vyšetřování ztráty třídní knihy",
      "České nebe",
      "Hospoda Na mýtince",
      "Dlouhý, Široký a Krátkozraký",
      "Hra s opravdovým deštěm",
      "Záskok",
      "Němý Bobeš",
      "Afrika",
      "Akt"
    ]
  }
}
