{
  "name": "wc3-hrdinove",
  "description": "Verbatim Czech dub quotes from Warcraft 3 Heroes",
  "tags": ["cs", "games", "retro", "dubbing", "warcraft", "wc3", "heroes"],
  "spinnerVerbs": {
    "mode": "replace",
    "verbs": [
      "Stanu se chloubou svého otce a království",
      "Nechť světlo vede mé kroky",
      "Světlo, dej mi sílu",
      "Mrazivý smutek hladoví!",
      "Tady bych měl velet já",
      "Pšš, snažím se tu přemýšlet",
      "Vždycky jsem toužila jen po studiu",
      "Magické proudy jsou na vzestupu",
      "Asi bych těžko snášel, kdybych někomu nenakopal zadek",
      "Oni pošlou chlapa do nemocnice, ty svého do márnice",
      "Mí lidé musí být pomstěni",
      "Z mého domova zbyly jen trosky a popel",
      "Má touha po magii zatmívá rozum",
      "Aliance zradila můj lid",
      "Na tohle už jsem moc starý",
      "Jako kdyby orkové nestačili",
      "Na mé gloriole ulpívá prach",
      "Mým kostelem je bitevní pole",
      "Dokážu strefit letícího ptáka do oka",
      "Budeš litovat, že si kdy vstoupil do mých lesů",
      "Pojď a okusíš hněv elfů",
      "Nerad pracuji s těmito lidmi",
      "Kdo není člověk, nemá právo žít",
      "Nikdy nevěř elfovi",
      "Lok'tar Ogar!",
      "Velitel jsem tady já",
      "Matka země je nablízku",
      "Copak se nikdy nedočkám klidu?",
      "Varsong zvítězí",
      "Svítí, svítí slunce nad hlavou",
      "Zvířata mě poslouchají",
      "Vidíš ten kámen? To je můj polštář",
      "No to jsem z toho jelen",
      "Král Ličů mi dal skutečnou sílu",
      "Lordaeron bude znovu zrozen",
      "Arthas povraždil můj lid",
      "Můj kraj a já jedno jsme",
      "Hořím nedočkavostí",
      "Můj bratr bude za svou zradu pykat",
      "Illidana uvězním nebo zemřu"
    ]
  }
}
